issuekey,title,description,storypoint
KANOO-4759,GDS - Users - CSV Upload History - View Details and Resume,"As a GDS user, I want to be able to view the result of an uploaded CSV file under the CSV Upload History tab of GDS system in order to decide the action to retry the unsuccessful records based on the status of CSV File defined in [https://kardsys.atlassian.net/browse/KANOO-4728|https://kardsys.atlassian.net/browse/KANOO-4728|smart-link] .* Processing** Disable all download links * Completed Status** Enable all download links*   Partially Completed** Enable all download links** I can have an option to retry the current file to resume to process the records that are not processed yet. It means that the system needs to save the row number that is processed in [https://kardsys.atlassian.net/browse/KANOO-4728|https://kardsys.atlassian.net/browse/KANOO-4728|smart-link] to be able to resume.** The resume process will follow the workflow define in [https://kardsys.atlassian.net/browse/KANOO-4728|https://kardsys.atlassian.net/browse/KANOO-4728|smart-link] * The detailed report of each CSV history file must have the below data.** Total Users (this is available in the current version) *** Have a link to download the list of these records** Processed Users (this is available in the current version) → change to “Successful Users”*** Have a link to download the list of these records** Failed Users - this is a new value*** Have a link to download the list of these records*** I can download the CSV file of failed records with the columns in the same format as CSV upload file and have more columns in that file.**** Status**** Error*** I expect that I can use the download CSV file of failed records in order to upload them to process again if I want as a new upload CSV file.* UI: [https://xd.adobe.com/view/851d9c19-fcb7-4403-b1a5-c4b9bed7467f-d04e/screen/a910b417-5d78-4636-96af-e712e0eb92cd/|https://xd.adobe.com/view/851d9c19-fcb7-4403-b1a5-c4b9bed7467f-d04e/screen/a910b417-5d78-4636-96af-e712e0eb92cd/|smart-link] * Git: Kanoo GitHub\\Kanoo Mobile App\\03-Design\\Web\\Social Services.xd",8
KANOO-4750,[BE][KanooPOS] - Set the maximum number of attempts to enter wrong passwords for 5,"After fixing [https://kardsys.atlassian.net/browse/KANOO-4099|https://kardsys.atlassian.net/browse/KANOO-4099|smart-link] , I received an official request from Kanoo that they want the maximum number of attemps to be *5.*",2
KANOO-4747,Visipay - Merchant Balance - Correct Balance In Report,"VAs Kanoo Admin, I want to have a function to settle the balance report stored for each day during a time frame of a merchant cash card based on the successful transactions happening in that date range.* Develop a function to run the settlement within a date range and this process will be triggered manually from Visipay.* The settlement progress of each merchant will be executed with the information.** The settlement process must be done for each day within the settlement date range and store the correct value of the merchant balance into the report for each date. *** Revenue of a day = total credit - total debit - fee - fee VAT (all transactions of that day)**** balance of day n = balance of day n-1 + revenue of day n** This process must be handled in the background and display a new balance on Visipay - Merchant Balance Report.*** Old Balance - this is the balance saved before the settlement.*** New Balance - new balance is saved after the settlement.** Visipay Admin will export the balance report with new balance value and the new balance value will be the same as the old balance by default if there is no settlement for that date.** The settlement process can be executed again whenever the Kanoo admin decides to do that, so the system does not need to validate this.** If there is no transaction for a date, let store the same balance report of the previous day so that we can have the balance report for any date for any merchant.",8
KANOO-4738,Provide API to create Kanoo merchant for SDE Agency,"Provide API for SDE (Sand Dollar Ecosystem) to call to create a merchant account when SDE creates a new agency from that system.* Require  properties for the input** Business Name: <Agency Name>** Email Address: <Agency Email>** Address: Nassau, The Bahamas** Phone Number: <Agency Phone Number>** Country: Bahamas** City: Nassau** First Name: SDE Merchant** Last Name: <a random id generated, including 5 digits>** Business Category: COMMUNITY AND GOVERNMENT** Business Sub Category: GOVERNMENT DEPARTMENTS AND AGENCIES** Subscription Plan: DIAMOND Elite. Allow 6-month trial.** Password: This is generated randomly and will be sent to agency through email (view [https://kardsys.atlassian.net/browse/KANOO-4836|https://kardsys.atlassian.net/browse/KANOO-4836|smart-link] )** Sand Dollar PIN: this is generated randomly and will be sent to agency through email (view [https://kardsys.atlassian.net/browse/KANOO-4836|https://kardsys.atlassian.net/browse/KANOO-4836|smart-link] )** Avatar: use the default image* After that merchant is created, it is automatically enabled, no need of ARM Admin’s approval, no need of OTP verification* Expected properties in the response in order SDE to store to integrate with PWK for process payment of invoices later.** Merchant ID** Authentication Code* Merchant account for SDE must have both KK and SD card in order to receive payments for all available payment methods of Kanoo system.",5
KANOO-4728,[BE] GDS - Users - Process CSV File of Gift Cards,"Currently, while the system processes the whole CSV file in one request and this request can be failed at some points and the system does not record the processing result and there is no record in CSV Upload History as well although some gift cards have been sent successfully.As a GDS manager, I want to improve the process of sending gift cards from a CSV file to be able to have a full status of that processing.* Access “Add Multiple Users” function on GDS and then upload a file.* The system needs to save the file to process it in the background and I don’t need to wait for the processing result. I will check the processing result in CSV Upload History screen later.* When the CSV file is being processed, I will see “Processing” status in CSV Upload History screen for this file.* If all records of the file are processed regardless of the number of gift cards are sent successfully, the status of this CSV file is Completed.* If all records of the file are not processed due to any reason, the status is “Partially Completed”.* This process must record the detail of each gift card with the below status.** Success: the gift card sent to the user successfully.** Invalid Data: any value of the record has an invalid format or data.** Failed: the gift card cannot be sent to the user.[https://xd.adobe.com/view/851d9c19-fcb7-4403-b1a5-c4b9bed7467f-d04e/screen/a910b417-5d78-4636-96af-e712e0eb92cd/|https://xd.adobe.com/view/851d9c19-fcb7-4403-b1a5-c4b9bed7467f-d04e/screen/a910b417-5d78-4636-96af-e712e0eb92cd/|smart-link] Kanoo GitHub\\Kanoo Mobile App\\03-Design\\Web\\Social Services.xd",8
KANOO-4722,[Android] SDE - Invoice Payment,Follow the requirement in : [https://kardsys.atlassian.net/browse/KANOO-4721|https://kardsys.atlassian.net/browse/KANOO-4721|smart-link] ,8
KANOO-4721,[iOS] SDE - Invoice Payment,"As a Kanoo user trying to pay invoice, I should have the ability to pay the invoice via Kanoo mobile apps. This si to take advantages of available payment methods such as Kanoo Cash Card and Sand Dollar Card.*Acceptance Criteria:** There is a new button called Public Services. (see the attached image to see the icon position changes)* Clicking on Public Services button goes to the screen to enter Invoice ID. ** I use Done button in keyboard to search Invoice ID** Each status code below will have a specific messageagency_not_existed: {color:#00b8d9}_“Agency does not exist“_{color} This means we can not find Agency of invoiceinvoice_id_not_existed: {color:#00b8d9}_“Invoice ID does not exist“_{color} This means we can not find the invoice IDservice_unavailable: {color:#00b8d9}_“Sorry, Service is temporarily unavailable“_ {color}This means there is a problem when calling to DigiPay server** If that invoice has been paid, it moves to the screen with the invoice details and PAID status* Supported Departments: This is the list of Agencies created in SDE Admin page** Ensure the list is sorted by Onboard date * If there is an invoice that has been NOT paid, it navigates to Confirm & Pay screen** Display the information on the invoice. There is no Service and Fee** Payment methods are the same as the current payment methods that Kanoo app is supporting for Bill Pay merchants.*** Kanoo Cash Card (default)*** Sand Dollar Card** “Make Payment“ button: clicking on this moves to PIN-entering screen* PIN-entering screen, this works as other PIN-entering in apps, also ensure that it validates things below** If Sand Dollar Card/Kanoo Cash Card does not have enough money, It displays the message “Your card doesn't have enough money to complete the process. Please choose another card.”** If it’s over Monthly Transaction Limit of KYC rule (for both level 1 and 2), display messages as when making payment with Kanoo Cash Card.* If payment is successful, it navigates to Payment Successful\! screen** Display the information of invoice** Transaction ID: it displays Transaction ID has generated** Close button: Clicking on this is back to Home screen* Transaction: there is a transaction recorded in User site, Visipay, Merchant site** Transaction Type: Invoice Payment** Remitter: <full name of user>/<last 4 digits of Kanoo KK or SD card>** Beneficiary: <merchant’s business name>/<last 4 digits of Kanoo KK or SD card>_Home page (see the attached image to see the icon position changes)_* Change text “Your Cart“ into “Cart“!image-20210607-102911.png|width=380,height=649!Mock-up: [https://xd.adobe.com/view/8be7559f-c183-41db-9491-949f77fa1f6f-deb4/screen/f643351c-398b-4917-aa9f-987028568c3d|https://xd.adobe.com/view/8be7559f-c183-41db-9491-949f77fa1f6f-deb4/screen/f643351c-398b-4917-aa9f-987028568c3d|smart-link] ",8
KANOO-4686,[ARM] Move google api key from code logic to configuration file,"Currently on ARM project, we are setting the google api key: (*AIzaSyDkQJlHp-e-MQPGHSzKDOV_JNMl1qLrruU*) directly on jsp file => move this setting to configuration file (*.properties).",3
KANOO-4685,[BE] - Confirmation Order Email - Generate emails in case of order status NEW,"When a logged-user making order with selecting delivery method Pickup or Delivery, I should be able to instantly receive an email (for status NEW) when just creating that order. *Acceptance Criteria:** After logged-user successfully created orders by Pickup or Delivery (Status Order is NEW), it immediately sends an email to Pickup Email or Delivery Email that I submitted* This only applies for logged-user because we have handled this flow for guest* This also applies to KZ site*Email Template:*+_Delivery_+!image-20210610-072715.png|width=100%!+_Pickup_+!image-20210610-072827.png|width=100%!",2
KANOO-4679,[KZ Site] - Logged-in User - Confirm PIN while making payments,"As a logged-user, it is necessary to confirm PIN in each payment (product buying)*Acceptance Criteria:** In checkout screen, when clicking on Pay button, it displays Confirm PIN modal* The cursor is positioned on PIN field by default* “Confirm & Pay“ button is disable by default. When PIN field contains enough 4 digits, enable the button.* When user enters an incorrect PIN then clicks “Confirm & Pay“ button, display message in a modal {color:#00b8d9}_“PIN is incorrect“_{color}* If user enters a correct PIN, it complete the payment as normal.*Sample*:!image-20210531-100900.png|width=100%!!image-20210531-102300.png|width=100%!",3
KANOO-4676,[BE] - Order Confirmation Email - Update Point Redemption ,"As a user making payments with point use, I should have the ability to view the point redemption on the order confirmation email*Acceptance Criteria:** On Order Email content, display a line time below Coupon called Point Redemption. This displays exactly** The number of points that has been used in that order. For example, Point Used: 122** The amount being equivalent to that number of points: For example, -$1.22 * In case of 0 points use, display -$0.00 and Point used: 0* The number of points must always have comma* This only applies to logged-user orders because guest can NOT uses points to make payments *Sample*:!image-20210531-083832.png|width=606,height=645!",2
KANOO-4670,Execute Performance Test,"* List out all features that need to be checked for performance. Below is the initial list.** Visipay:***  Dashboard*** Transactions**** Search**** Export*** Cash Card**** Cash Card Listing**** Transactions of each cash card*** Claim Payments for Merchant and Resend to Sender** ARM Merchant - Transactions** Gift Card Distribution - Report*** Search*** Export** PWK: *** Guest - Pay with External SD card*** Kanoo User - Pay with Cash Card, Gifted Cash Card and Internal SD card* Work with [~accountid:5eeb358e96b9660abf6c15b5] to check the result of [https://kardsys.atlassian.net/browse/KANOO-4671|https://kardsys.atlassian.net/browse/KANOO-4671|smart-link] to request [~accountid:5b102742c2fc1b1bc37ba3ef] to support to add data to be the same at least production through [https://kardsys.atlassian.net/browse/KANOO-4657|https://kardsys.atlassian.net/browse/KANOO-4657|smart-link] * Also, run the automation script to upgrade the sandbox to have the same data as production every week.* Conduct performance tests on the sandbox environment that should be the same structure, configuration, and data as production to find out the issues that need to be solved.* The output of this ticket will be input for [https://kardsys.atlassian.net/browse/KANOO-3948|https://kardsys.atlassian.net/browse/KANOO-3948|smart-link]  for [~accountid:5c75f48232e60d5a276b3f0a] to identify the new indexes to add and also solutions to improve queries of functions that have problems with performance.",8
KANOO-4659,[FE] -[ARM Merchant] - Account - Change Sand Dollar PIN,"As a ARM merchant that added Sand Dollar card, I should have the ability to change Sand Dollar PIN.*Acceptance Criteria** Go to Account page then Business Sand Dollar Card. If merchant has added a Sand Dollar card, there is a button called “Change PIN“* I have to enter ** Current PIN ** New PIN** Confirm New PIN* Save button** Validate 3 fields above*** Current PIN is incorrect.*** PIN must have 4 number characters.*** Confirm New PIN does not match.** If passing all validation, display message {color:#00b8d9}_“Your Sand Dollar PIN has been updated successfully“_{color}* Back button: clicking on this is back to the first screen having “Change PIN“ button and clears all field values* The new PIN saved is applied to all features that require merchant to enter Sand Dollar PIN*Sample*:!image-20210527-070433.png|width=100%!!image-20210529-153800.png|width=100%!!image-20210527-070048.png|width=100%!",2
KANOO-4657,Performance Test - Add Data,"* *Scenario 1*: add more transactions by running PWK automation script for both Guest and Kanoo wallet - this is available.** 10k transactions/day/merchant** Add data for 5 merchants** Run for 6 months at one time to have 9000k transactions* *Scenario 2*: add transactions of gift card insurance and redemption ** Steps*** Access Gift Card Distribution site with Manager role using the link and account in [https://kardsys.atlassian.net/wiki/spaces/KAN/pages/623025/Servers+and+Accounts|https://kardsys.atlassian.net/wiki/spaces/KAN/pages/623025/Servers+and+Accounts|smart-link] *** Access Users menu and then select Add User → Multiple Users*** Upload the file of 3000 gift cards $100 to issue 3000 gift cards at one time.*** Redeem one gift card 20 times ($5 at one time) at a linked merchant in order to have 10 redeem transactions for one gift card by purchasing products on Kanoo web app and use the issued gift card to pay.** Expected data*** One month**** 3000 gift cards**** 60,000 redeem transactions*** Run for 6 months at one time",13
KANOO-4642,[BE] KanooPOS - Pay - Allow using Coupons ,"As a staff or manager paying by KanooPOS, I should have the ability to scan QR codes of coupon.*Acceptance Criteria:** When using Pay on KanooPOS, clicking on Scan button can scan QR code or enter character code of a coupon.* If that code is not a valid code by any reasons, display the message “This is an invalid code”* If that code is valid, it applies that coupon immediately. There is a new section called Coupon positioned above . It displays the value of selected coupon. Depending on the coupon types, after scanning/ typing QR code, the discount is applied as below** If coupon type is %OFF, display the exact number calculated. For example, Payment Amount is $10.00 (no discount) and I use 50% OFF coupon so that I see “Coupon >    -$5.00”.** If coupon type is Voucher, display the exact number. For example, Payment Amount is $10.00 (no discount) and I use $5.00 coupon (voucher) so that I see “Coupon >    -$5.00”.** If coupon type is Buy X Get Y,  display the text “Gift products“* We have 3 PAY workflows in KanooPOS. Below is how each type of coupon is applied in each Pay workflow** Pay:*** Voucher: Apply as normal*** %OFF: **** If that coupon is applied to ALL products, it is scanned as normal and discount as normal**** If that coupon is applied to a specific product, it is scanned as normal and discount as normal. This is based on the awareness of the staff who is using that POS.*** Buy X Get Y: Scanning this applies the coupon as normal. This is based on the awareness of the staff who is using that POS.** Pay in Order Creation workflow: including Pay with QR and Pay Later*** Voucher: Apply as normal*** %OFF:**** If that coupon is applied to ALL products, it is scanned as normal and discount as normal**** If that coupon is applied to a specific product, scanning it discounts only that specific product*** Buy X Get Y: Scanning this applies the coupon as normal but it will not effect to the product stocks. We have will have a story to remake it.* After I applied the coupon, clicking on > button goes to details page where I can see the information of applied coupon** If coupon type is %OFF, display the image, name, %OFF amount (ex, 10% or 50%). ** If coupon type is Voucher, display the image, name, Voucher amount (ex, $100.00, $7.00)** If coupon type is Buy X Get Y, display the image and name * After I scanned a coupon (or enter character code), If I want to change to another coupon, I can scan another coupon. The new one replaces the old one.* I can select only one Coupon to Pay. This can be one of 3 types as above* I can use both gift cards and coupon at the same time.* Ensure the priority of use is the same with Checkout flow in Kanoo apps: Coupon, Gift Card, User Card* Transaction: after paying with coupons successfully, I see transaction written in Visipay, KanooPOS, ARM** Transaction type: Coupon Redemption** Amount: this is the amount reduced. In case of Buy X Get Y, amount is $0.00* Transaction in KanooPOS: we have had a transaction type called “Coupon“. It is changed to “Coupon Redemption“ *Mock-up:* [https://xd.adobe.com/view/4608bf03-0b46-417b-a4da-f80b3e81d2e0-135b/|https://xd.adobe.com/view/4608bf03-0b46-417b-a4da-f80b3e81d2e0-135b/|smart-link] ",5
KANOO-4614,Support Multiple Kanoo Admin Users,* Need to create multiple admin users for Kanoo to access Visipay and ARM.* Each admin user will have the same account profile as the current admin user that we have.* Visipay - Fund Kanoo Cash Card - the logged admin will receive OTP through their email or phone number.* Admin user can change their profile on ARM as the current function of My Account menu.,5
KANOO-4613,[Android] KanooPOS - Set the maximum number of attempts to enter wrong passwords for 5,"After fixing [https://kardsys.atlassian.net/browse/KANOO-4099|https://kardsys.atlassian.net/browse/KANOO-4099|smart-link] , I received an official request from Kanoo that they want the maximum number of attemps to be *5.*",1
KANOO-4611,Kanoo - Save Transactions When External Users Use Gift Cash Card,"*AC 1:* If Kanoo users use Gift Cash Card, transactions will keep the same as the current process*AC 2:* If external users use Gift Cash Card, they can only use at POS for feature Pay and Topup minute. If they download the app and register an account with the same email received the gift, the transactions are saved as AC1On POS, ARM, ARM Master, and Visipay: the system saved remitter information # Name: GUEST - <full name># Card number: must-have# Phone: must-have# Email: must-have",5
KANOO-4609,[BE] - Multiple Merchant Money Flow,"Currently, when a user receives a Gift Cash Card that can be used at multiple merchants from GDS, the issuer’s Cash Card balance isn't deducted. The user can use it at the issued merchant or another accepted merchant. If he uses it at the issued merchant, the payment flow doesn't change. If he uses it at another accepted merchant, that merchant has to pay the fee related to the function and paid amount. This doesn't make sense so that we need to define the flow.The solution is after a user uses a Gift cash Card at an accepted merchant ( except the issued merchant) successfully. Kanoo Reserve Account will fund the paid amount for the accepted merchant immediately. The accepted merchant only pays the fee related to the function. Below is the money flow when a user uses a Gift Cash Card from GDS at multiple linked merchants.*Step 1:* a GDS manager creates, marks issuer merchant then sends Gift Cash Card to users successfully. The issuer merchant pays nothing for Kanoo*Step 2:* The user uses the Gift Cash Card at a linked merchant and issuer successfully.The linked merchant pays the fee *“Kanoo Cash Card - Processing Fee”* for Kanoo based on the paid amount and function. *Save transaction as the current flow on ARM, Visipay.*We don’t need to transfer money from Kanoo Reserve Cash Card to linked merchant.",5
KANOO-4606,[BE] GDS - All Roles - View Reports,"As a Manager, I would like to view transactions relate to Gift Cash Card. I expect that when I access 2 tabs reports, I would see# Change the column “Gift Card Image” to “Gift Image”# Change “Cash” to “Cash Card” in the filter## This applies to all 3 tabs Issuance, Error/Exceptions, Redemption## *When filtering, I should receive data of Gift Cash Card*All behaviors will be the current processMockup: [https://xd.adobe.com/view/05686a06-7af4-4bd0-9897-2390271e9f82-503b/screen/8118ec77-5bff-43b8-9553-b7cafd0b9083/|https://xd.adobe.com/view/05686a06-7af4-4bd0-9897-2390271e9f82-503b/screen/8118ec77-5bff-43b8-9553-b7cafd0b9083/|smart-link] ",3
KANOO-4603,[WEB] GDS - User Details - View Issuance History,"As a Manager, after issuing a Gift Cash Card for a user, I would like to view it information in the User details*Step1:* I would like to see “Cash Card” in “Payment Method” and “Method”*Step 2:* I view the “Issuance History”* Disappear the button “Disable”, “Get QR“Mockup: [https://xd.adobe.com/view/05686a06-7af4-4bd0-9897-2390271e9f82-503b/screen/f191e1d1-c379-4b08-ab0b-5c34fac31818/|https://xd.adobe.com/view/05686a06-7af4-4bd0-9897-2390271e9f82-503b/screen/f191e1d1-c379-4b08-ab0b-5c34fac31818/|smart-link] ",2
KANOO-4599,External User Receive Gift Cash Card,"As a consumer who has not registered a Kanoo account, I would like to receive Gift Cash Card through email so that I can use it at acceptable merchants by giving the QR codeRegardless this is the first time I receive the Gift Cash Card from a Merchant or not, the title displays the latest balance I received, but the QR code contains the sum of the amount I have received up to now*Email content*Title: You've received a Cash Card <last 4> with <amount $> balance from KanooContent:QR imageQR valueCard NumberPresent QR Code to Pay with <gift type> at Kanoo acceptable merchants.",3
KANOO-4593,Change Log Level On ExceptionController,"Please change log level from {color:#ff5630}error{color}-> {color:#ff5630}info {color}for AccountControlException, ServiceProcessingException, {{MethodArgumentTypeMismatchException}}Class: \[common] com.visikard.controllers.ExceptionController.javaMethod: {code:java}@ExceptionHandler(value = {AccountControlException.class, ServiceProcessingException.class})    @ResponseBody    @RequestMapping(produces = MediaType.APPLICATION_JSON_VALUE, value = {""/""})    public String handleSQLException(HttpServletRequest request, Exception e) throws JsonProcessingException {        String message = e.getMessage();        Throwable cause = e.getCause();        LOGGER.error(""Return error for user: [{}]"", message);}@ExceptionHandler(value = {MethodArgumentTypeMismatchException.class})@ResponseBody@RequestMapping(produces = MediaType.APPLICATION_JSON_VALUE, value = {""/""})public GeneralApiResponse<String> handleTypeMismatchException(MethodArgumentTypeMismatchException e, HttpServletRequest request) {    LOGGER.error(""Type mismatch exception"", e);    return new GeneralApiResponse<>(""incorrect_parameter"", 1, null);}{code}*Line 56:* LOGGER.{color:#ff5630}error{color}(""Return error for user: \[\{}]"", message); →  LOGGER.{color:#ff5630}info{color}(""Return error for user: \[\{}]"", message);*Line 89:* LOGGER.{color:#ff5630}error{color}(""Type mismatch exception"", e); → LOGGER.{color:#ff5630}info{color}(""Type mismatch exception"", e);",1
