issuekey,title,description,storypoint
KANOO-3611,FE - Manager Role - Users - View Users List and CSV Uploaded History,"As a DOSS Manager, I want to able to create recipients by uploading, view report of sending, view report of using GC of each recipient through time, and edit Profile.*Acceptance Criteria:*I log in to DOSS site by using Manager account. On the list of left menu items, I would like to see items: Users, Reports, Profile, Sign Out. Default access “Profile” page.I can click *Users* item to open Users page. There are two tabs here: “Users”, “CSV Upload History”.On the *Users page*, I can see:# A list of Users that added by all Managers, including columns:## NIB number## Full Name## Address## Center Location## Email## Phone## Payment Amount## Payment Method## -Payment Frequency- (*March 16, 2021)*## Preferred Method QR Code## Last Update Date: sample format *Mar 06, 2021, 16:10*## Linked Merchant## Action: including two icons “Delete” and “Edit”.# Default columns are shown on the table: NIB Number, Full Name, Phone, Email, Payment Amount, Payment Method, -Payment Frequency,- Last Update Date, Action. (*March 11, 2021)*# I can select columns that I want to show/hide on the table.  (*March 11, 2021)*# Displaying User’s info maximum in -2- 1 lines. (*March 11, 2021)* If the data is too long, use ellipsis. I can hover the mouse pointer to view fully.# I can search Users by NIB number, name, address, Center location, email, phone number, Payment method.## If no result matches the search, show the text *“No Users found.”*## If searching with an empty keyword → return to all records of the list.# By default, the list is sorted by the latest updated date from the top downwards.# Be able to sort on columns:## NIB number: sort by alphabet (a-z / z-a)## Full Name/Address: sort by alphabet (a-z / z-a)## Center Location: sort by alphabet (a-z / z-a)## -Payment Frequency: sort by alphabet (a-z / z-a)- ## Preferred Method QR Code: sort by alphabet (a-z / z-a)# I can *view details* of each User by clicking on any record. The popup will be displayed. On this popup, I can see:## All fields are disabled by default.## Account’s basic info: Display full info of all fields such as Full Name, Address, Email, Phone, Payment Amount (show amount in the last time sending), Payment Method, -Payment Frequency,- Preferred Method QR Code, Linked Merchant, Center Location.## Issuance History: I would like to see the issuance histories of a User. When *sending* n GKs *to the same User (based* on *NIB number) (March 15, 2021)*, the history should be saved here. The list should be sorted by the sent date (newest to oldest).### Including columns: #### Method: displaying payment method.#### Amount: displaying payment amount when sending.#### Amount Used: displaying amount that the customer has used.#### Status: displaying Used Gift Card Status such as “Not used”, “Partially Used”, “Used”.#### Email: displaying Email used to send. Displays the sign ""-"" when there is no data to display. (*March 15, 2021)*#### Phone: displaying phone used to send. Displays the sign ""-"" when there is no data to display. (*March 15, 2021)*#### Issuance Status: Displaying issuance status of each GK such as “Success” or “Unissued” or “Partial Success”.#### Date: displaying the added GK date, sample format *Mar 06, 2021, 16:10*#### QR Code: If Gift card status is “Not used” or “Partially Used” → display “Get QR” button. Otherwise, display text “N/A'.### I can filter the issuance histories with the “Success” issuance status by turning ON “Show only success” button. Turn it OFF to show all issuance histories.### Each record will display info maximum in 1 line. If the data is too long, use ellipsis. I can hover the mouse pointer to view fully.### Click “Get QR” button on the “QR Code” column to download a pdf file. I can open this file to view QR code and other information.!image-20210308-064731.png|width=39.72895863052781%!## Click “X” icon on the top right pop-up to close the popup.*Edit User*I want to able to edit an added User in the list. I can click “Edit” icon on a record to open the “Edit User” popup. The UI should be the same as when adding a single User. On this popup:# I can edit all fields such as NIB number, First Name, Last Name, Email, Location, Center Location, Address, Payment Amount, Payment Method, -Payment Frequency-, Preferred QR Method, Linked Merchant, Phone Number, Document Name, or uploading another document.# The new info must follow the same rule when adding a single User.# Clicking “Edit and Send” button on the bottom of the pop-up, closing the popup, and show a toast message: “This process may take up a few minutes. You can check its status on Reports.”## Update data of old record to new data.## Show on the top of the list.# Clicking “Cancel” button to cancel editing and close the pop-up.*Delete User*I can click Delete icon to delete a User in the list.When clicking, show the confirmation pop-up *“Are you sure to delete User <Full Name of User>?“* with two buttons:# Delete:## closing the pop-up and deleting the account, show a toast message *“The User <Full Name of User> is deleted successfully.”* OK button.## Delete unsuccessfully: show a toast message: *The User <Full Name of User> is deleted unsuccessfully.”* OK button.# Cancel: closing the pop-up, the action is canceled.On the *CSV Upload History* page, I can see:# I want to able to view the history of uploading CSV of myself. Refer ticket [Add and Send GK to Multiple Users|https://kardsys.atlassian.net/browse/KANOO-3563].# Displaying as list view, including columns:## Upload Date: displaying the upload date. Sample format *Mar 06, 2021, 16:10*## Processed Users: displaying the number of users that sent GK successfully.## Total Users: displaying the number of total users in uploaded CSV.## Upload Completed Date: Displaying the upload completed date. Sample format *Mar 06, 2021, 16:10*## Manager Name: displaying my name, who uploaded CSV.",5
KANOO-3610,BE - Manager Role - Users - View Users List and CSV Uploaded History,"As a DOSS Manager, I want to able to create recipients by uploading, view report of sending, view report of using GC of each recipient through time, and edit Profile.*Acceptance Criteria:*I log in to DOSS site by using Manager account. On the list of left menu items, I would like to see items: Users, Reports, Profile, Sign Out. Default access “Profile” page.I can click *Users* item to open Users page. There are two tabs here: “Users”, “CSV Upload History”.On the *Users page*, I can see:# A list of Users that added by all Managers, including columns:## NIB number## Full Name## Address## Center Location## Email## Phone## Payment Amount## Payment Method## -Payment Frequency- (*March 16, 2021)*## Preferred Method QR Code## Last Update Date: sample format *Mar 06, 2021, 16:10*## Linked Merchant## Action: including two icons “Delete” and “Edit”.# Default columns are shown on the table: NIB Number, Full Name, Phone, Email, Payment Amount, Payment Method, -Payment Frequency,- Last Update Date, Action. (*March 11, 2021)*# I can select columns that I want to show/hide on the table.  (*March 11, 2021)*# Displaying User’s info maximum in -2- 1 lines. (*March 11, 2021)* If the data is too long, use ellipsis. I can hover the mouse pointer to view fully.# I can search Users by NIB number, name, address, Center location, email, phone number, Payment method.## If no result matches the search, show the text *“No Users found.”*## If searching with an empty keyword → return to all records of the list.# By default, the list is sorted by the latest updated date from the top downwards.# Be able to sort on columns:## NIB number: sort by alphabet (a-z / z-a)## Full Name/Address: sort by alphabet (a-z / z-a)## Center Location: sort by alphabet (a-z / z-a)## -Payment Frequency: sort by alphabet (a-z / z-a)- ## Preferred Method QR Code: sort by alphabet (a-z / z-a)# I can *view details* of each User by clicking on any record. The popup will be displayed. On this popup, I can see:## All fields are disabled by default.## Account’s basic info: Display full info of all fields such as Full Name, Address, Email, Phone, Payment Amount (show amount in the last time sending), Payment Method, -Payment Frequency,- Preferred Method QR Code, Linked Merchant, Center Location.## Issuance History: I would like to see the issuance histories of a User. When *sending* n GKs *to the same User (based* on *NIB number) (March 15, 2021)*, the history should be saved here. The list should be sorted by the sent date (newest to oldest).### Including columns: #### Method: displaying payment method.#### Amount: displaying payment amount when sending.#### Amount Used: displaying amount that the customer has used.#### Status: displaying Used Gift Card Status such as “Not used”, “Partially Used”, “Used”.#### Email: displaying Email used to send. Displays the sign ""-"" when there is no data to display. (*March 15, 2021)*#### Phone: displaying phone used to send. Displays the sign ""-"" when there is no data to display. (*March 15, 2021)*#### Issuance Status: Displaying issuance status of each GK such as “Success” or “Unissued” or “Partial Success”.#### Date: displaying the added GK date, sample format *Mar 06, 2021, 16:10*#### QR Code: If Gift card status is “Not used” or “Partially Used” → display “Get QR” button. Otherwise, display text “N/A'.### I can filter the issuance histories with the “Success” issuance status by turning ON “Show only success” button. Turn it OFF to show all issuance histories.### Each record will display info maximum in 1 line. If the data is too long, use ellipsis. I can hover the mouse pointer to view fully.### Click “Get QR” button on the “QR Code” column to download a pdf file. I can open this file to view QR code and other information.!image-20210308-064731.png|width=39.72895863052781%!## Click “X” icon on the top right pop-up to close the popup.*Edit User*I want to able to edit an added User in the list. I can click “Edit” icon on a record to open the “Edit User” popup. The UI should be the same as when adding a single User. On this popup:# I can edit all fields such as NIB number, First Name, Last Name, Email, Location, Center Location, Address, Payment Amount, Payment Method, -Payment Frequency-, Preferred QR Method, Linked Merchant, Phone Number, Document Name, or uploading another document.# The new info must follow the same rule when adding a single User.# Clicking “Edit and Send” button on the bottom of the pop-up, closing the popup, and show a toast message: “This process may take up a few minutes. You can check its status on Reports.”## Update data of old record to new data.## Show on the top of the list.# Clicking “Cancel” button to cancel editing and close the pop-up.*Delete User*I can click Delete icon to delete a User in the list.When clicking, show the confirmation pop-up *“Are you sure to delete User <Full Name of User>?“* with two buttons:# Delete:## closing the pop-up and deleting the account, show a toast message *“The User <Full Name of User> is deleted successfully.”* OK button.## Delete unsuccessfully: show a toast message: *The User <Full Name of User> is deleted unsuccessfully.”* OK button.# Cancel: closing the pop-up, the action is canceled.On the *CSV Upload History* page, I can see:# I want to able to view the history of uploading CSV of myself. Refer ticket [Add and Send GK to Multiple Users|https://kardsys.atlassian.net/browse/KANOO-3563].# Displaying as list view, including columns:## Upload Date: displaying the upload date. Sample format *Mar 06, 2021, 16:10*## Processed Users: displaying the number of users that sent GK successfully.## Total Users: displaying the number of total users in uploaded CSV.## Upload Completed Date: Displaying the upload completed date. Sample format *Mar 06, 2021, 16:10*## Manager Name: displaying my name, who uploaded CSV.",1
KANOO-3609,FE- Manager Role - Users - Add and Send GC to Single User,"As a DOSS manager, I would like to add a user to send GC.# Access menu Users → Add Users → Single User.# I can input info in the following fields. All fields below are required.## NIB number: only accept letters and numbers \[a-z] \[A-Z] \[0-9]. Limit 20 characters. Placeholder “Enter NIB number”## First Name: allow entering text. Max length 20 characters*.* Placeholder “Enter first name”. If the name has space characters at the beginning or end, it should be auto trimmed.## Last Name: allow entering text. Max length 20 characters*.* Placeholder “Enter last name”. If the name has space characters at the beginning or end, it should be auto trimmed.## Email: limit 100 characters. Placeholder “Enter email”. If entered an incorrect format, show red text *“Invalid email address format.”*.### Pattern: Allow \[a-z] \[A-Z] \[0-9], dash (_) and periods (.). The first and last character of the email must be \[a-z] \[A-Z] \[0-9]## -Location: This is a text field. limit 100 characters. Placeholder “Location”. Allow inputting letter \[a-z]\[A-Z], number \[0-9]. Some special characters such as period, comma.- (*March 11, 2021*)## Address: Allow entering letters \[a-z]\[A-Z], number \[0-9], comma, and period signs. Limit 200 characters. Placeholder “Address”.## Center Location: limit 100 characters. Allow entering letters\[a-z]\[A-Z], number \[0-9], comma, and period signs. Placeholder “Center Location”.## Payment amount: Placeholder “Payment amount”. Only accept integers from 5 to 500. Show red text *“Invalid format.”* if the value is not digits. *“Range of <field name> is from <number> to <number>.”* if value is out of range.## Payment Method: Dropdown list including one option “Gift Card”. Default is “Gift Card”. ## -Payment Frequency: This is a dropdown list including options “Once, Daily, Weekly, Monthly, Yearly”. Default is “Payment Frequency”.- (*March 16, 2021)*## Preferred QR Method: This is a drop-down list box of options that accepts multiple selections including options “Application, -Printed- Email, SMS”. *(March 16, 2021)*## Linked Merchant: This is multiple select dropdowns including all activated merchants in the system. ## Phone Number *(optional)*: Placeholder “Phone number”. Only accept digits. Limit 20 characters in length. Use the current UI and validation rule of the system, reference [https://kardsys.atlassian.net/browse/KANOO-2126|https://kardsys.atlassian.net/browse/KANOO-2126|smart-link].## Gift Card Background: allows upload image file used for Gift Card image.### Limitation: 8MB. If the file is over limitation, I will receive message “Image file exceeds 8MB limit. Please choose a different file.”### JPEG (.jpeg/.jpg), and PNG (.png) format. If upload an unsupported file, I will receive message “This file type is not supported. Please choose a different file.” # I can input Email or Phone number or both. If both are empty, require User to input Email.# Clicking “Add and Send” button will validate data: ## If entered data is over limitation, show red text below that field: *“Max length of <field name> is <number>.”*## If the required field is empty, show red text below that field: *“This field is required.”*## Auto scrolling to the first validation error.# Click button “Add and Send” ## If successful sending, show pop-up “This process may take up a few minutes. You can check its status on Reports.”## If fail sending for any case by the system: “An error has occurred. Please try again later.”.## The system should detect if entered email or phone number is an internal or external User.### For internal User: refer to ticket [https://kardsys.atlassian.net/browse/KANOO-3567|https://kardsys.atlassian.net/browse/KANOO-3567|smart-link] ### For external User: refer to ticket [https://kardsys.atlassian.net/browse/KANOO-3566|https://kardsys.atlassian.net/browse/KANOO-3566|smart-link] ## Add this User to the Users list. ## *March 15, 2021:* Check for duplicate NIB in the existing list, not case sensitive.### If a new User's NIB is existing in the list:#### update the old User’s info to the new User’s info.#### Issuance History: Keep the old records and add a new record into the Issuance History section. Record phone and email after each sending.### If a new User’s NIB is not existing in the list, add this user to the list as a new record.# The number of Users that sent failed will be displayed on Button “Reissue(<the number of Users that sent failed >)”. I can click on this button to re-send the gift cards to these Users.# Record status on Report menu.",8
KANOO-3608,BE- Manager Role - Users - Add and Send GC to Single User,"As a DOSS manager, I would like to add a user to send GC.# Access menu Users → Add Users → Single User.# I can input info in the following fields. All fields below are required.## NIB number: only accept letters and numbers \[a-z] \[A-Z] \[0-9]. Limit 20 characters. Placeholder “Enter NIB number”## First Name: allow entering text. Max length 20 characters*.* Placeholder “Enter first name”. If the name has space characters at the beginning or end, it should be auto trimmed.## Last Name: allow entering text. Max length 20 characters*.* Placeholder “Enter last name”. If the name has space characters at the beginning or end, it should be auto trimmed.## Email: limit 100 characters. Placeholder “Enter email”. If entered an incorrect format, show red text *“Invalid email address format.”*.### Pattern: Allow \[a-z] \[A-Z] \[0-9], dash (_) and periods (.). The first and last character of the email must be \[a-z] \[A-Z] \[0-9]## -Location: This is a text field. limit 100 characters. Placeholder “Location”. Allow inputting letter \[a-z]\[A-Z], number \[0-9]. Some special characters such as period, comma.- (*March 11, 2021*)## Address: Allow entering letters \[a-z]\[A-Z], number \[0-9], comma, and period signs. Limit 200 characters. Placeholder “Address”.## Center Location: limit 100 characters. Allow entering letters\[a-z]\[A-Z], number \[0-9], comma, and period signs. Placeholder “Center Location”.## Payment amount: Placeholder “Payment amount”. Only accept integers from 5 to 500. Show red text *“Invalid format.”* if the value is not digits. *“Range of <field name> is from <number> to <number>.”* if value is out of range.## Payment Method: Dropdown list including one option “Gift Card”. Default is “Gift Card”. ## -Payment Frequency: This is a dropdown list including options “Once, Daily, Weekly, Monthly, Yearly”. Default is “Payment Frequency”.- (*March 16, 2021)*## Preferred QR Method: This is a drop-down list box of options that accepts multiple selections including options “Application, -Printed- Email, SMS”. *(March 16, 2021)*## Linked Merchant: This is multiple select dropdowns including all activated merchants in the system. ## Phone Number *(optional)*: Placeholder “Phone number”. Only accept digits. Limit 20 characters in length. Use the current UI and validation rule of the system, reference [https://kardsys.atlassian.net/browse/KANOO-2126|https://kardsys.atlassian.net/browse/KANOO-2126|smart-link].## Gift Card Background: allows upload image file used for Gift Card image.### Limitation: 8MB. If the file is over limitation, I will receive message “Image file exceeds 8MB limit. Please choose a different file.”### JPEG (.jpeg/.jpg), and PNG (.png) format. If upload an unsupported file, I will receive message “This file type is not supported. Please choose a different file.” # I can input Email or Phone number or both. If both are empty, require User to input Email.# Clicking “Add and Send” button will validate data: ## If entered data is over limitation, show red text below that field: *“Max length of <field name> is <number>.”*## If the required field is empty, show red text below that field: *“This field is required.”*## Auto scrolling to the first validation error.# Click button “Add and Send” ## If successful sending, show pop-up “This process may take up a few minutes. You can check its status on Reports.”## If fail sending for any case by the system: “An error has occurred. Please try again later.”.## The system should detect if entered email or phone number is an internal or external User.### For internal User: refer to ticket [https://kardsys.atlassian.net/browse/KANOO-3567|https://kardsys.atlassian.net/browse/KANOO-3567|smart-link] ### For external User: refer to ticket [https://kardsys.atlassian.net/browse/KANOO-3566|https://kardsys.atlassian.net/browse/KANOO-3566|smart-link] ## Add this User to the Users list. ## *March 15, 2021:* Check for duplicate NIB in the existing list, not case sensitive.### If a new User's NIB is existing in the list:#### update the old User’s info to the new User’s info.#### Issuance History: Keep the old records and add a new record into the Issuance History section. Record phone and email after each sending.### If a new User’s NIB is not existing in the list, add this user to the list as a new record.# The number of Users that sent failed will be displayed on Button “Reissue(<the number of Users that sent failed >)”. I can click on this button to re-send the gift cards to these Users.# Record status on Report menu.",2
KANOO-3607,BE- Manager Roles - Users - Add and Send GC to Multiple Users,"As a DOSS manager, I would like to add multiple users to send GC# Access menu Users → Add Users → Multiple User# Click option “Only send to those who have registered with the Kanoo app.” → after uploading successfully → only send for internal users # Click to select a file from local storage or Download template ( view attached file) then upload# After uploading, show incorrect data with detailed errors when hovering the mouse in incorrect records. # Can close or back to upload another file# Validation:## Required fields: all fields in template. Message “<field name> is required.”## Limit file is 40MB. Reject file if over limitation. Message “The uploaded file exceeds 40MB limit. Please choose a different file.”## Reject file if it is not a CSV file. Message “This file type is not supported. Please choose a different file.”## Values format:### NIB number: only accept letters and numbers \[a-z] \[A-Z] \[0-9]. Limit 20 characters. Message “Max length of <field name> is <number>.”. “Invalid format.” if incorrect format### Email: 100 characters. Message “Invalid email address format.” if incorrect format or “Max length of <field name> is <number>.” if over limitation.#### Pattern: Allow \[a-z] \[A-Z] \[0-9], dash (_) and periods (.). The first and last character of the email must be \[a-z] \[A-Z] \[0-9] ### First Name and Last Name: only text. 20 characters. Message “Max length of <field name> is <number>.” “Invalid format.” if incorrect format### Phone: accept only 20 digits. ex: 1242…. Message “Max length of <field name> is <number>.” “Invalid format.” if incorrect format### Address: Allow entering letters, numbers, comma, and period signs. 200 characters. Message “Max length of <field name> is <number>.”.  “Invalid format.” if incorrect format### *Mar 16, 2021*: -Rank; accept only 1 character. Message “Max length of <field name> is <number>.”. “Invalid format.” if incorrect format-### Payment amount: only accept integers from 5 to 500. Message “Invalid format.” if the value are characters, “Range of <field name> is from <number> to <number>.” if value is out of range. “Invalid format.” if incorrect format### *Mar 16, 2021* -Payment Frequency: message “The value should be: Once, Daily, Monthly, or Yearly.” if the value is different-### Payment Method: message “The value should be GiftCard” if the value is different### *Mar 16, 2021* Preferred method for QR-code: message “The value should be: Application, SMS, or Email -Printed-.” if the value is different### Linked merchant: emails of merchants. no limit. Message “Invalid email address format.” if incorrect format### Center Location: limit 100 characters. Allow entering letters, numbers, comma, and period signs. “Max length of <field name> is <number>.”. “Invalid format.” if incorrect format## *Mar 15, 2021*: Duplicated records ( only in the file): based on NIB number-, Email, Phone- → Message “This record is duplicated.” # Upload successfully → click Add and Send → pop-up “Gift Card will be sent to users based on email and phone. This process may take up a few minutes. You can check its status on Reports.”## If option “Clarify Users” is checked → send for internal users## If option “Clarify Users” is unchecked → send for internal and external users# *Mar 15, 2021*: Add these sent users to User list, only check NIB number with the current NIB in the User list## If they are different → save as a new record## If they are the same → update the current info with the new and add one more record in the Issuance History # Save a record in CSV history # Send to n users will save n transactions.",5
